{
  "schemaVersion": 1,
  "caseId": "case-b",
  "freshContext": true,
  "inputDigests": {
    "skills/evolve/SKILL.md": "90e56864aa15560d447f7c435634c90ddf848507832ba60827a9a5dd0855f10b",
    "skills/evolve/references/cleanup-policy.md": "592735477b24f215c4def0f6ad1d4c5bf9e2a4ab62330950d5782e7b4d40de7d",
    "tests/acceptance/fixtures/review-context-semantic-generalization.json": "038cca94e9582fa514f29a72bafa1328baa7f56201acbae61e32d1f23836581c",
    "tests/acceptance/review-context-semantic-generalization.runner.json": "6fe7d783080be40c268d78bef1fd9159d918cff0c33ca0975978930de216eede",
    "tests/acceptance/review-context-semantic-generalization-result.schema.json": "e3b84da818b93a9c65bd783ca9b88f35fdc87f0759ab7a685380d5e36dd822fa"
  },
  "decision": "no_candidate",
  "invariant": null,
  "includedRuleIds": [],
  "includedProposalIds": [],
  "excludedRuleIds": [
    "rule-keyboard-access",
    "rule-cli-redaction",
    "rule-hook-idempotency",
    "rule-scheduler-timezone"
  ],
  "excludedProposalIds": [
    "2026-07-05-keyboard-access",
    "2026-07-06-cli-redaction",
    "2026-07-07-hook-idempotency",
    "2026-07-08-scheduler-timezone"
  ],
  "preservedDomainDetails": [
    {
      "proposalId": "2026-07-05-keyboard-access",
      "detail": "Focus visibility and semantic role remain necessary to verify equivalent keyboard access."
    },
    {
      "proposalId": "2026-07-06-cli-redaction",
      "detail": "Structured and fallback error formatting must both be tested for credential disclosure."
    },
    {
      "proposalId": "2026-07-07-hook-idempotency",
      "detail": "The event identity key must survive the retry boundary to prevent duplicate effects."
    },
    {
      "proposalId": "2026-07-08-scheduler-timezone",
      "detail": "Skipped and repeated local times must both be covered to verify wall-clock behavior."
    }
  ],
  "counterexamples": [
    "A control may execute its action correctly while remaining unreachable by keyboard, so generic execution-success verification does not preserve accessibility.",
    "A CLI failure may follow the intended error path while leaking a credential, so privacy-safe output is not equivalent to reachability or effect completion.",
    "A retried hook may reach its handler successfully twice and duplicate the domain event, so successful execution does not preserve idempotency.",
    "A scheduled job may run exactly once yet at the wrong local time across a daylight-saving boundary, so single execution does not preserve time-zone semantics."
  ],
  "behaviorLostIfApproved": "A forced merge would erase distinct, observable guarantees for keyboard accessibility, credential redaction, retry idempotency, and configured wall-clock timing; a generic execution rule would not test the failure stage of any case precisely.",
  "netActiveContextChange": {
    "replacedRuleCount": 0,
    "replacementRuleCount": 0,
    "delta": 0
  },
  "approvalRequired": false,
  "proposalWouldBeCreated": false,
  "repositoryMutated": false,
  "privacy": {
    "rawTraceStored": false,
    "absolutePathStored": false,
    "secretsStored": false
  }
}
